{
  "entry_id": "OS-ANTIGRAVITY-AURORA-AGENTS-SKILLS-20260418-005-summary",
  "os_id": "OS-ANTIGRAVITY-AURORA-AGENTS-SKILLS-20260418-005",
  "step_name": "SUMMARY — gerado ao concluir OS-005",
  "step_number": 0,
  "agent": "antigravity",
  "model": "gemini-1.5-pro",
  "input_tokens": 28500,
  "output_tokens": 18200,
  "total_tokens": 46700,
  "cost_usd_estimated": 0.126,
  "cost_brl_estimated": 0.88,
  "duration_ms": 0,
  "timestamp": "2026-04-18T16:00:00-03:00",
  "notes": "Entry retroativa baseada em estimativa de tokens de processamento de 16 skills.",
  "cache_hit": false
}
