{
  "entry_id": "OS-MADLAB-OS018-20260604-001-step-5",
  "os_id": "OS-MADLAB-OS018-20260604-001",
  "step_name": "Encapsulate FactoryAgent as StoriesBuilder Alignment",
  "step_number": 5,
  "agent": "antigravity",
  "model": "gemini-1.5-pro",
  "input_tokens": 150000,
  "output_tokens": 5000,
  "total_tokens": 155000,
  "cost_usd_estimated": 0.2125,
  "cost_brl_estimated": 1.4875,
  "duration_ms": 300000,
  "timestamp": "2026-06-05T16:00:00-03:00",
  "notes": "Aligned generate_ui_tree to accept stories_plan and compatibility_mode. Added validation checking plan presence, blueprint signature hash, strategies check, component traceability checks against stories_plan, block layout degradation (SafeDegradedNode) on architectural components. Injected motion capabilities check and matched synthetic fixture promotion block in dag_orchestrator.py and promote.py. Verified via test_stories_builder_alignment.py (101 tests passing) and E2E Certification (fixture-mode). Evaluated with quality_gate.py (score 5.0 approved) and ingested into Ozzmosis qa-learning.",
  "cache_hit": false
}
