{
  "entry_id": "OS-MADLAB-OS018-20260604-001-step-4",
  "os_id": "OS-MADLAB-OS018-20260604-001",
  "step_name": "SynthesisDAG Integration & E2E Validation",
  "step_number": 4,
  "agent": "antigravity",
  "model": "gemini-1.5-pro",
  "input_tokens": 90000,
  "output_tokens": 3000,
  "total_tokens": 93000,
  "cost_usd_estimated": 0.1275,
  "cost_brl_estimated": 0.8925,
  "duration_ms": 300000,
  "timestamp": "2026-06-05T11:10:00-03:00",
  "notes": "Integrated BuildPlanResolver and StoriesBuilderGate into the SynthesisDAG pipeline in dag_orchestrator.py, handled sandbox/staging persistence of stories_build_plan.json and stories_builder_gate_report.json, added offline fallback in real_page_probe.py, passed all 92 tests, and ran E2E certification successfully.",
  "cache_hit": false
}
