{
  "entry_id": "OS-MADLAB-OS018-20260604-001-step-2",
  "os_id": "OS-MADLAB-OS018-20260604-001",
  "step_name": "BuildPlanResolver implementation & contract traceability mapping",
  "step_number": 2,
  "agent": "antigravity",
  "model": "gemini-1.5-pro",
  "input_tokens": 45000,
  "output_tokens": 3500,
  "total_tokens": 48500,
  "cost_usd_estimated": 0.0825,
  "cost_brl_estimated": 0.5775,
  "duration_ms": 300000,
  "timestamp": "2026-06-04T19:33:00-03:00",
  "notes": "Implemented BuildPlanResolver transforming ExperienceBlueprint into StoriesBuildPlan with SHA256 signature binding and multi-surface (landing, canvas, dashboard, portal) resolution test cases. All 84 tests passing.",
  "cache_hit": false
}
