{
  "entry_id": "OS-MADLAB-OS019-20260606-001",
  "os_id": "OS-MADLAB-OS019-20260606-001",
  "step_name": "Stories Builder First Real Product Candidate",
  "step_number": 1,
  "agent": "antigravity",
  "model": "gemini-1.5-pro",
  "input_tokens": 140000,
  "output_tokens": 7000,
  "total_tokens": 147000,
  "cost_usd_estimated": 0.1695,
  "cost_brl_estimated": 1.187,
  "duration_ms": 14000,
  "timestamp": "2026-06-06T12:06:18-03:00",
  "notes": "Generated the first real product candidate for Mad Lab Stories landing page from reference URL https://www.exoape.com/ using --no-mocks under the Mad Lab Theme (Z-axis perspective, editorial spacing, Display Serif typography, Monospace metadata). Resolved ExperienceBlueprint with freeform_depth and canvas_navigation, resolved StoriesBuildPlan, passed StoriesBuilderGate validation, compiled 5_SynthesizedPage.client.tsx UI code, passed EvaluateVisualFidelity (89.2% intent, 30% clone risk) and EvaluatePerceptualFidelity (100%), sandbox verified, and paused at HumanPromotionGate with candidate_status set to REVIEWABLE_CANDIDATE.",
  "cache_hit": false
}
