{
  "entry_id": "OS-MADLAB-OS018-20260604-001-step-3",
  "os_id": "OS-MADLAB-OS018-20260604-001",
  "step_name": "StoriesBuilderGate implementation & test suite validation",
  "step_number": 3,
  "agent": "antigravity",
  "model": "gemini-1.5-pro",
  "input_tokens": 65000,
  "output_tokens": 5000,
  "total_tokens": 70000,
  "cost_usd_estimated": 0.1275,
  "cost_brl_estimated": 0.8925,
  "duration_ms": 400000,
  "timestamp": "2026-06-05T10:14:00-03:00",
  "notes": "Implemented StoriesBuilderGate validating plan constraints, physical hash signatures, and element traceability (P0/P1/P2/P3 findings) and created test_stories_builder_gate.py. Passed all 92 integrated tests.",
  "cache_hit": false
}
