{
  "entry_id": "OS-ANTIGRAVITY-AURORA-GOVERNANCE-20260418-008-ledger",
  "os_id": "OS-MULTIPLE-AURORA-20260418-004-008",
  "step_name": "LEDGER — registro consolidado de auditoria e upgrade",
  "step_number": 1,
  "agent": "antigravity",
  "model": "gemini-2.0-flash",
  "input_tokens": 55000,
  "output_tokens": 20000,
  "total_tokens": 75000,
  "cost_usd_estimated": 0.016,
  "cost_brl_estimated": 0.11,
  "duration_ms": 1200000,
  "timestamp": "2026-04-18T17:55:00-03:00",
  "notes": "Consolidação de custos para OS-008 (QA v1.1.0) e OS-004 (Visual Audit). Gap de 15min reportado para extração de padrões incluído.",
  "cache_hit": true
}
