{
  "entry_id": "OS-MADLAB-TS-STABILIZATION-20260601-001-step-1",
  "os_id": "OS-MADLAB-TS-STABILIZATION-20260601-001",
  "step_name": "TypeScript stabilization execution & verification",
  "step_number": 1,
  "agent": "antigravity",
  "model": "gemini-3.5-flash",
  "input_tokens": 22500,
  "output_tokens": 2500,
  "total_tokens": 25000,
  "cost_usd_estimated": 0.00325,
  "cost_brl_estimated": 0.02275,
  "duration_ms": 360000,
  "timestamp": "2026-06-01T10:45:00-03:00",
  "notes": "Successfully resolved all 23 TypeScript compilation errors across components and configurations.",
  "cache_hit": false
}
