{
  "entry_id": "OS-MADLAB-OS018-20260604-001-step-6",
  "os_id": "OS-MADLAB-OS018-20260604-001",
  "step_name": "Real E2E Certification with Blueprint -> BuildPlan -> Builder",
  "step_number": 6,
  "agent": "antigravity",
  "model": "gemini-1.5-pro",
  "input_tokens": 180000,
  "output_tokens": 6000,
  "total_tokens": 186000,
  "cost_usd_estimated": 0.255,
  "cost_brl_estimated": 1.785,
  "duration_ms": 450000,
  "timestamp": "2026-06-06T09:05:00-03:00",
  "notes": "Executed the E2E certification run with --no-mocks and --promotion-mode candidate-only. Crawled real target antigravity.google via Playwright (ignore_https_errors=True), resolved Hybrid Truth, generated the experience blueprint, resolved stories_build_plan.json, passed StoriesBuilderGate validation, generated TSX UI code complying strictly with build plan, passed visual and perceptual gates, created the candidate staging bundle, and paused at HumanPromotionGate with promotable flags set and candidate_status = PROMOTABLE_CANDIDATE. All 34 orchestrator tests and 23 builder tests pass.",
  "cache_hit": false
}
